{
  "schema_version": "1.0",
  "message_id": "0194f0a0-0000-7000-8000-000000000001",
  "message_type": "agent.assignment.v1",
  "created_at": "2026-08-06T18:04:51Z",
  "region": "us-east-1",
  "tenant_id": "tenant-a",
  "classification": "SENSITIVE",
  "producer": "static-log-analysis",
  "correlation_id": "0194f0a0-0000-7000-8000-000000000002",
  "incident_id": "aaaaaaaaaaaaaaaaaaaaaaaaaaaaaaaaaaaaaaaaaaaaaaaaaaaaaaaaaaaaaaaa",
  "incident_generation": 42,
  "investigation_id": "0194f0a0-0000-7000-8000-000000000003",
  "service_id": "paymentservice",
  "environment": "production",
  "severity": "error",
  "context_version": 1
}
